{
  "format": "gantry.concurrent-refinement-model/v1",
  "maximum_depth": 14,
  "explored_state_count": 9986,
  "terminal_state_count": 2482,
  "obligations": [
    "all-settled-source-order",
    "cancellation-nonconsumption",
    "enabled-task-progress",
    "fixed-outcome-observation-isolation",
    "foreground-terminal-separation",
    "linear-handle-ownership",
    "per-task-transition-order",
    "shared-machine-refinement",
    "shutdown-cohort-closure",
    "task-settlement-at-most-once",
    "terminal-completion-uniqueness",
    "weak-fair-runnable-polling",
    "closed-generic-task-transfer",
    "schedule-independent-static-selection",
    "no-concurrent-generic-analysis"
  ],
  "assumptions": [
    "The analyzed package is well typed and every child executes the shared explicit-frame Machine.",
    "Continuously runnable Gantry futures are weakly fairly polled and ready executor or adapter responses eventually become observable.",
    "Submitting tasks and genuinely pending integration work may remain pending until their documented external prerequisite resolves.",
    "The lifecycle search is bounded to one execution, one root, two child tasks, and the declared maximum trace depth; it is not an unbounded proof."
  ],
  "counterexamples": [
    {
      "id": "child-before-submission",
      "trace": ["spawn-a"],
      "rejected_action": "settle-a-succeeded",
      "invariant": "per-task-transition-order"
    },
    {
      "id": "detach-after-join",
      "trace": ["spawn-a", "submit-a-ok", "join-a"],
      "rejected_action": "detach-a",
      "invariant": "linear-handle-ownership"
    },
    {
      "id": "double-join",
      "trace": ["spawn-a", "submit-a-ok", "join-a"],
      "rejected_action": "join-a",
      "invariant": "linear-handle-ownership"
    },
    {
      "id": "double-settlement",
      "trace": ["spawn-a", "submit-a-ok", "settle-a-succeeded"],
      "rejected_action": "settle-a-failed",
      "invariant": "task-settlement-at-most-once"
    },
    {
      "id": "finish-shutdown-before-terminal",
      "trace": ["begin-shutdown"],
      "rejected_action": "finish-shutdown",
      "invariant": "shutdown-cohort-closure"
    },
    {
      "id": "foreground-before-attached-settlement",
      "trace": ["spawn-a", "submit-a-ok", "fail-root"],
      "rejected_action": "foreground-complete",
      "invariant": "foreground-terminal-separation"
    },
    {
      "id": "open-generic-submission",
      "trace": [],
      "rejected_action": "submit-open-generic",
      "invariant": "closed-generic-task-transfer"
    },
    {
      "id": "root-settlement-before-attached-drain",
      "trace": ["spawn-a", "submit-a-ok", "fail-root"],
      "rejected_action": "settle-root-failed",
      "invariant": "task-settlement-at-most-once"
    },
    {
      "id": "runtime-trait-selection",
      "trace": [],
      "rejected_action": "resolve-trait-at-runtime",
      "invariant": "no-concurrent-generic-analysis"
    },
    {
      "id": "schedule-dependent-target-rewrite",
      "trace": [],
      "rejected_action": "rewrite-concrete-call-target",
      "invariant": "schedule-independent-static-selection"
    },
    {
      "id": "source-after-cancellation",
      "trace": ["spawn-a", "submit-a-ok", "cancel-execution"],
      "rejected_action": "detach-a",
      "invariant": "cancellation-nonconsumption"
    },
    {
      "id": "source-while-join-pending",
      "trace": ["spawn-a", "submit-a-ok", "join-a"],
      "rejected_action": "spawn-b",
      "invariant": "all-settled-source-order"
    },
    {
      "id": "terminal-before-detached-settlement",
      "trace": ["spawn-a", "submit-a-ok", "detach-a", "settle-root-succeeded", "foreground-complete"],
      "rejected_action": "terminal-complete",
      "invariant": "foreground-terminal-separation"
    },
    {
      "id": "terminal-twice",
      "trace": ["settle-root-succeeded", "foreground-complete", "terminal-complete"],
      "rejected_action": "terminal-complete",
      "invariant": "terminal-completion-uniqueness"
    }
  ],
  "coordinator_searches": [
    {
      "id": "integrated-coordinator-lifecycle",
      "state_domains": [
        { "field": "created", "values": ["false", "true"] },
        { "field": "creation-published", "values": ["false", "true"] },
        { "field": "submitted", "values": ["false", "true"] },
        { "field": "registered", "values": ["false", "true"] },
        { "field": "gate-open", "values": ["false", "true"] },
        { "field": "joined", "values": ["false", "true"] },
        { "field": "detached", "values": ["false", "true"] },
        { "field": "cancelled", "values": ["false", "true"] },
        { "field": "abort-requested", "values": ["false", "true"] },
        { "field": "semantic-settled", "values": ["false", "true"] },
        { "field": "physical-settled", "values": ["false", "true"] },
        { "field": "permit-released", "values": ["false", "true"] },
        { "field": "waiter", "values": ["absent", "registered", "queued", "ready"] },
        { "field": "child-events", "values": ["0", "1"] },
        { "field": "root-settled", "values": ["false", "true"] },
        { "field": "foreground", "values": ["false", "true"] },
        { "field": "terminal", "values": ["false", "true"] }
      ],
      "action_domain": [
        "create-child",
        "publish-creation",
        "submit-driver",
        "register-driver",
        "release-gate",
        "join-handle",
        "detach-handle",
        "request-cancellation",
        "request-abort",
        "register-waiter",
        "settle-child-semantic",
        "notify-waiter",
        "settle-child-physical",
        "release-permit",
        "publish-child-event",
        "settle-root",
        "complete-foreground",
        "complete-terminal"
      ],
      "initial": {
        "description": "No child exists; no driver, waiter, settlement, event, or completion coordinate has been published.",
        "assignments": [
          { "field": "created", "value": "false" },
          { "field": "creation-published", "value": "false" },
          { "field": "submitted", "value": "false" },
          { "field": "registered", "value": "false" },
          { "field": "gate-open", "value": "false" },
          { "field": "joined", "value": "false" },
          { "field": "detached", "value": "false" },
          { "field": "cancelled", "value": "false" },
          { "field": "abort-requested", "value": "false" },
          { "field": "semantic-settled", "value": "false" },
          { "field": "physical-settled", "value": "false" },
          { "field": "permit-released", "value": "false" },
          { "field": "waiter", "value": "absent" },
          { "field": "child-events", "value": "0" },
          { "field": "root-settled", "value": "false" },
          { "field": "foreground", "value": "false" },
          { "field": "terminal", "value": "false" }
        ]
      },
      "terminal": {
        "description": "The child is published, registered, gated, semantically and physically settled, observed, event-published, and closed through root, foreground, and terminal completion.",
        "assignments": [
          { "field": "created", "value": "true" },
          { "field": "creation-published", "value": "true" },
          { "field": "submitted", "value": "true" },
          { "field": "registered", "value": "true" },
          { "field": "gate-open", "value": "true" },
          { "field": "semantic-settled", "value": "true" },
          { "field": "physical-settled", "value": "true" },
          { "field": "permit-released", "value": "true" },
          { "field": "waiter", "value": "ready" },
          { "field": "child-events", "value": "1" },
          { "field": "root-settled", "value": "true" },
          { "field": "foreground", "value": "true" },
          { "field": "terminal", "value": "true" }
        ]
      },
      "closure": "queue-exhaustion",
      "safety_ceiling": 200000,
      "explored_state_count": 488,
      "terminal_state_count": 6,
      "maximum_shortest_depth": 17,
      "frontier_state_count": 0,
      "fixed_point": true
    },
    {
      "id": "auxiliary-resource-identity",
      "state_domains": [
        { "field": "task-a", "values": ["none", "one", "two"] },
        { "field": "task-b", "values": ["none", "one", "two"] },
        { "field": "operation-a", "values": ["none", "one", "two"] },
        { "field": "operation-b", "values": ["none", "one", "two"] },
        { "field": "permit-a", "values": ["false", "true"] },
        { "field": "permit-b", "values": ["false", "true"] },
        { "field": "transition-a", "values": ["false", "true"] },
        { "field": "transition-b", "values": ["false", "true"] },
        { "field": "operation-budget-a", "values": ["false", "true"] },
        { "field": "operation-budget-b", "values": ["false", "true"] }
      ],
      "action_domain": [
        "assign-task-a-one",
        "assign-task-a-two",
        "assign-task-b-one",
        "assign-task-b-two",
        "assign-operation-a-one",
        "assign-operation-a-two",
        "assign-operation-b-one",
        "assign-operation-b-two",
        "acquire-permit-a",
        "acquire-permit-b",
        "consume-transition-a",
        "consume-transition-b",
        "consume-operation-a",
        "consume-operation-b"
      ],
      "initial": {
        "description": "Neither actor owns a task identity, operation identity, capacity-one permit, transition unit, or operation unit.",
        "assignments": [
          { "field": "task-a", "value": "none" },
          { "field": "task-b", "value": "none" },
          { "field": "operation-a", "value": "none" },
          { "field": "operation-b", "value": "none" },
          { "field": "permit-a", "value": "false" },
          { "field": "permit-b", "value": "false" },
          { "field": "transition-a", "value": "false" },